Company,Recovery
Progressive Northern Insurance Company,0.0
Progressive Northwestern Insurance Company,0.0
Progressive Specialty Insurance Company,0.0
Property and Casualty Insurance Company of Hartford,921.8669662921349
Protective Insurance Company,764.6964705882353
Protective Life Insurance Company,0.0
Protective Property & Casualty Insurance Company,0.0
Providence Mutual Fire Insurance Company,264.47468749999996
Provident Life and Accident Insurance Company,0.0
Pruco Life Insurance Company,0.0
Prudential Insurance Company of America,900.3892168674698
QBE Insurance Corporation,0.0
QBE Specialty Insurance Company,1032.2928571428572
Quincy Mutual Fire Insurance Company,293.3991379310345
RLI Insurance Company,0.0
ROOT Insurance Company,121.25750000000001
Regent Insurance Company,164.3390909090909
ReliaStar Life Insurance Company,25973.961
ReliaStar Life Insurance Company of New York,258.8355555555556
Reliance Standard Life Insurance Company,0.0
RepWest Insurance Company,0.0
Republic-Franklin Insurance Company,2277.7337837837836
RiverSource Life Insurance Company,3372.2337254901963
Riverport Insurance Company,0.0
Royal Arcanum Supreme Council,0.0
SAFECO Insurance Company of America,581.2812903225807
SAFECO Insurance Company of Illinois,590.3948125
SAFECO Insurance Company of Indiana,0.0
SCOR Global Life Americas Reinsurance Company,0.0
SILAC Insurance Company,0.0
Safe Auto Insurance Company,0.0
Safety National Casualty Corporation,0.0
"Samsung Fire & Marine Insurance Co., Ltd (U.S. Branch)",0.0
Scottsdale Insurance Company,0.0
Securian Casualty Company,0.0
Securian Life Insurance Company,0.0
Security Benefit Life Insurance Company,0.0
Security Life of Denver Insurance Company,0.0
Security Mutual Life Insurance Company of New York,0.0
Security National Insurance Company,0.0
Select Insurance Company,0.0
Selective Insurance Company of America,0.0
Selective Insurance Company of South Carolina,1386.3870967741937
Selective Insurance Company of the Southeast,0.0
"Seneca Insurance Company, Inc.",4003.591111111111
Seneca Specialty Insurance Company,0.0
"Sentinel Insurance Company, Ltd",722.139649122807
Sentry Insurance Company,272.2325
Sentry Select Insurance Company,156.29
ShelterPoint Life Insurance Company,0.0
SiriusPoint America Insurance Company,27397.0
SiriusPoint Specialty Insurance Corporation,0.0
"Sonsio International, Inc.",0.0
Spinnaker Insurance Company,0.0
Spirit Commercial Auto Risk Retention Group Inc.,0.0
Standard Fire Insurance Company (The),328.60184300341297
Standard Insurance Company,106.71428571428571
Standard Security Life Insurance Company of New York,0.0
StarNet Insurance Company,0.0
StarStone Specialty Insurance Company,0.0
Starmount Life Insurance Company,0.0
Starr Indemnity & Liability Company,102.64
State Auto Property & Casualty Insurance Company,1097.0117647058823
State Automobile Mutual Insurance Company,1673.894
State Farm Fire & Casualty Company,4600.377339901478
State Farm Life Insurance Company,0.0
State Farm Mutual Automobile Insurance Company,360.81993742177724
State Life Insurance Company (The),0.0
"State National Insurance Company, Inc.",0.0
Steadfast Insurance Company,5204.902
Stewart Title Guaranty Company,0.0
Stillwater Insurance Company,13.65
Stillwater Property and Casualty Insurance Company,420.9230769230769
Strathmore Insurance Company,0.0
Sun Life Assurance Company of Canada,7.388888888888889
Sun Life and Health Insurance Company (U.S.),0.0
SunAmerica Annuity and Life Assurance Company,0.0
SunAmerica Life Insurance Company,0.0
Surety Life Insurance Company,0.0
Swiss Re Corporate Solutions Capacity Insurance Corporation,0.0
Symetra Life Insurance Company,0.0
TIAA-CREF Life Insurance Company,0.0
Talcott Resolution Life Insurance Company,0.0
Talcott Resolution Life and Annuity Insurance Company,0.0
Teachers Insurance Company,1525.7542857142855
Teachers Insurance and Annuity Association of America,0.0
"Technology Insurance Company, Inc.",0.0
The Burlington Insurance Company,0.0
The Doctors Company Risk Retention Group A Reciprocal Exchange,0.0
Thrivent Life Insurance Company,0.0
Time Insurance Company,391.06666666666666
Tokio Marine America Insurance Company,7500.0
Tokio Marine Specialty Insurance Company,0.0
Transamerica Advisors Life Insurance Company,0.0
Transamerica Casualty Insurance Company,29498.885333333335
Transamerica Financial Life Insurance Company,1605.8353719008267
Transamerica Life Insurance Company,2287.1001440329214
Transamerica Premier LIfe Insurance Company,2426.514081632653
"Transguard Insurance Company of America, Inc.",0.0
Transportation Insurance Company,0.0
Travelers Casualty Company (The),0.0
Travelers Casualty Company of Connecticut,0.0
Travelers Casualty Insurance Company of America,243.83333333333334
Travelers Casualty and Surety Company,0.0
Travelers Casualty and Surety Company of America,0.0
Travelers Commercial Insurance Company,0.0
Travelers Constitution State Insurance Company,0.0
Travelers Home and Marine Insurance Company (The),729.6184659090909
Travelers Indemnity Company (The),1079.9807142857142
Travelers Indemnity Company of America (The),1557.4733333333334
Travelers Indemnity Company of Connecticut (The),0.0
Travelers Personal Insurance Company,4063.538947368421
Travelers Personal Security Insurance Company,4737.712
Travelers Property Casualty Company of America,116.64363636363636
Travelers Property Casualty Insurance Company,0.0
Trenwick America Reinsurance Corporation,0.0
Truck Insurance Exchange,912.57921875
Trumbull Insurance Company,380.1959044368601
Twin City Fire Insurance Company,1960.569
TypTap Insurance Company,3678.635
U.S. Financial Life Insurance Company,0.0
U.S. Specialty Insurance Company,801.0
UNICARE Life & Health Insurance Company,0.0
UNUM Life Insurance Company of America,780.4406779661017
USAA Casualty Insurance Company,1186.5241176470588
USAA General Indemnity Company,1888.1088584474887
USAA Life Insurance Company,164.3446153846154
Underwriters at Lloyds London,5673.447397260274
Union Fidelity Life Insurance Company,0.0
Union Insurance Company,0.0
Union Mutual Fire Insurance Company,0.0
Union Security Insurance Company,0.0
United American Insurance Company,69.46000000000001
United Behavioral Health,0.0
United Concordia Insurance Company,69.402
United Financial Casualty Company,400.0
United National Insurance Company,0.0
United Ohio Insurance Company,14.0
United Property & Casualty Insurance Company,4015.58
United Service Protection Corporation,0.0
United Services Automobile Association,491.7421341463415
United Specialty Insurance Company,0.0
United States Fire Insurance Company,1669.5613855421686
United States Liability Insurance Company,49.916666666666664
United States Life Insurance Company in the City of New York,0.0
United of Omaha Life Insurance Company,0.0
UnitedHealthcare Insurance Company,2093.5907994842037
UnitedHealthcare Insurance Company of Illinois,5690.0
UnitedHealthcare Life Insurance Company,66.815
Unitrin Direct Insurance Company,17228.54
Unitrin Preferred Insurance Company,0.0
Unity Financial Life Insurance Company,0.0
Universal North America Insurance Company,3671.612372881356
Universal Underwriters Insurance Company,18.906
Unum Insurance Company,806.6671428571428
Utica First Insurance Company,268.11853658536586
Utica Mutual Insurance Company,336.271076923077
Utica National Assurance Company,589.5882352941177
Utica National Insurance Company of Ohio,0.0
Utica National Insurance Company of Texas,0.0
Valley Forge Insurance Company,0.0
Vanliner Insurance Company,0.0
Vantis Life Insurance Company,0.0
Venerable Insurance and Annuity Company,0.0
Vermont Mutual Insurance Company,44.99076923076923
Victoria Fire & Casualty Company,0.0
Vigilant Insurance Company,3183.3922222222222
Viking Insurance Company of Wisconsin,5400.0
Virginia Surety Company Inc.,55.81411764705882
Voya Retirement Insurance and Annuity Company,0.0
Voyager Indemnity Insurance Company,0.0
Washington National Insurance Company,0.0
Wausau Underwriters Insurance Company,0.0
"WellCare Health Insurance of Connecticut, Inc.",0.0
"WellCare of Connecticut, Inc.",0.0
Wellfleet Insurance Company,466.09090909090907
Wells Fargo Advisors Financial Network Purchasing Group,0.0
Wesco Insurance Company,1018.55
West American Insurance Company,0.0
West Coast Life Insurance Company,210.88
Westchester Fire Insurance Company,0.0
Western Surety Company,0.0
Western World Insurance Company,39024.59125
Westport Insurance Corporation,0.0
Wilcac Life Insurance Company,0.0
Wilco Life Insurance Company,44071.456
Wilton Reassurance Life Company of New York,0.0
Workers' Compensation Trust,0.0
Wright National Flood Insurance Company,0.0
"XL Insurance America, Inc.",0.0
XL Specialty Insurance Company,48.330000000000005
Zurich American Insurance Company,81.65898305084745
Zurich American Insurance Company of Illinois,688.46
Zurich American Life Insurance Company,0.0
